{"schema":"betabots.study-manifest.v1","id":"generic-checkout-study","title":"Generic checkout comprehension","researchQuestion":"Can first-time visitors understand checkout value?","hypotheses":["Clear delivery expectations improve confidence."],"target":{"app":"Generic Store","startUrls":["https://example.test/"]},"environment":{"attestationMode":"required"},"arms":[{"id":"neutral","type":"neutral","personaRefs":["persona.new-shopper"],"tasks":["Find a product."]},{"id":"conversion","type":"conversion","personaRefs":["persona.returning-shopper"],"tasks":["Compare delivery options."]},{"id":"treatment","type":"treatment","personaRefs":["persona.price-sensitive"],"tasks":["Assess the revised checkout."]}],"interactionPolicyRef":"policies/read-only-v1.json","authenticationLifecyclePolicy":"no-auth","evidenceRequirements":["screenshot","event-log"],"reproducibility":{"seed":"42","engine":"playwright","model":"gpt-5"},"limitations":["Synthetic behavior is directional, not population evidence."]}
